85437099410W,D_32,2452183.7680943017,854370,"Para receptores de televisión // Unidades emisoras de radiaciones      infrarrojas codificadas, utilizadas para el      mando a distancia (control remoto) // Los demás // Los demás // -Las demás máquinas y aparatos: // MÁQUINAS Y APARATOS ELECTRICOS CON",571117505.4372519,D_32,0.004293658913881288,Para receptores,Radio y televisión
85045000000X,D_32,1995159.3617833224,850450,"-Las demás bobinas de reactancia (autoinducción) // TRANSFORMADORES ELECTRICOS, CONVERTIDORES ELECTRICOS ESTÁTICOS (POR EJEMPLO:RECTIFICADORES) Y BOBINAS DE REACTANCIA (AUTOINDUCCIÓN).",571117505.4372519,D_32,0.003493430586155494,-Las demás bobi,Radio y televisión
85177091000X,D_32,1990199.0879673555,851770,"Gabinetes, bastidores y armazones // Las demás // -Partes // TELEFONOS, INCLUIDOS LOS TELEFONOS CELULARES (MÓVILES)* Y LOS DE OTRAS REDES INALÁMBRICAS; LOS DEMÁS APARATOS DE EMISIÓN, TRANSMISIÓN O RECEPCIÓN DE VOZ, IMAGEN U OTROS DATOS, INCLUIDOS LOS DE",571117505.4372519,D_32,0.0034847453790505752,"Gabinetes, bast",Radio y televisión
85437099939Z,D_31,19543888.71768671,854370,"Las demás // Lámparas conformadas por diodos de        luz (""LEDs"") // Los demás // Los demás // Los demás // -Las demás máquinas y aparatos: // MÁQUINAS Y APARATOS ELECTRICOS CON FUNCION PROPIA, NO EXPRESADOS NI COMPRENDIDOS EN OTRA PARTE DE ESTE CAPÍTU",145076818.6979174,D_31,0.1347140700567848,Las demás // Lá,Aparatos eléctricos
94051093300N,D_31,19054568.50870609,940510,"Los demás, de los tipos utilizados con      diodos emisores de luz (LED) // , de los tipos utilizados con      diodos emisores de luz (LED) // De metal común // Los demás // -Lámparas y demás aparatos eléctricos de alumbrado, para colgar o fijar al techo",145076818.6979174,D_31,0.13134123480045418,"Los demás, de l",Aparatos eléctricos
85021210000M,D_31,6836138.898771751,850212,De corriente alterna // --De potencia superior a 75 kVA pero inferior o  igual a 375 kVA // -Grupos electrógenos con motor de émbolo (pistón) de encendido por compresión (motores Diesel o semi-Diesel): // GRUPOS ELECTRÓGENOS Y CONVERTIDORES ROTATIVOSELEC,145076818.6979174,D_31,0.04712082164557338,De corriente al,Aparatos eléctricos
85359000990M,D_31,3873948.2850907543,853590,"Los demás // Los demás // -Los demás // APARATOS PARA CORTE, SECCIONAMIENTO, PROTECCIÓN, DERIVACIÓN, EMPALME O CONEXIÓN DE CIRCUITOSELECTRICOS (POR EJEMPLO: INTERRUPTORES,CONMUTADORES, CORTACIRCUITOS, PARARRAYOS,LIMITADORES DE TENSIÓN, SUPRESORES DESOBRE",145076818.6979174,D_31,0.026702738038095437,Los demás // Lo,Aparatos eléctricos
85393200000X,D_31,3563827.604209243,853932,"--Lámparas de vapor de mercurio o sodio; lámparas  de halogenuro metálico // -Lámparas y tubos de descarga, excepto los de rayos ultravioletas: // LÁMPARAS Y TUBOS ELECTRICOS DE INCANDESCENCIA ODE DESCARGA, INCLUIDOS LOS FAROS O UNIDADES«SELLADOS» Y LAS",145076818.6979174,D_31,0.024565107204548884,--Lámparas de v,Aparatos eléctricos
85044050000G,D_31,2771609.9681449686,850440,"Conversores electrónicos de frecuencia para   variación de velocidad de motores eléctricos // -Convertidores estáticos // TRANSFORMADORES ELECTRICOS, CONVERTIDORES ELECTRICOS ESTÁTICOS (POR EJEMPLO:RECTIFICADORES) Y BOBINAS DE REACTANCIA (AUTOINDUCCIÓN).",145076818.6979174,D_31,0.019104430280595584,Conversores ele,Aparatos eléctricos
85389090000C,D_31,2567388.7060551527,853890,"Las demás // -Las demás // PARTES IDENTIFICABLES COMO DESTINADAS, EXCLUSIVAO PRINCIPALMENTE, A LOS APARTOS DE LAS PARTIDAS85.35, 85.36 U 85.37.",145076818.6979174,D_31,0.017696753548208374,Las demás // -L,Aparatos eléctricos
85021110900Z,D_31,2566512.937605054,850211,Los demás // De corriente alterna // --De potencia inferior o igual a 75 kVA // -Grupos electrógenos con motor de émbolo (pistón) de encendido por compresión (motores Diesel o semi-Diesel): // GRUPOS ELECTRÓGENOS Y CONVERTIDORES ROTATIVOSELECTRICOS.,145076818.6979174,D_31,0.01769071696388044,Los demás // De,Aparatos eléctricos
85363000900R,D_31,2470348.895829611,853630,"Los demás // -Los demás aparatos para protección de circuitos eléctricos // APARATOS PARA CORTE, SECCIONAMIENTO, PROTECCIÓN,DERIVACIÓN, EMPALME O CONEXIÓN DE CIRCUITOSELECTRICOS (POR EJEMPLO: INTERRUPTORES,CONMUTADORES, RELES, CORTACIRCUITOS, SUPRESORESD",145076818.6979174,D_31,0.01702786784271465,Los demás // -L,Aparatos eléctricos
85044040100C,D_31,2380741.161823555,850440,"De potencia inferior o igual a 5 kVA // Equipo de alimentación ininterrumpida de   energía (UPS o «no break») // -Convertidores estáticos // TRANSFORMADORES ELECTRICOS, CONVERTIDORES ELECTRICOS ESTÁTICOS (POR EJEMPLO:RECTIFICADORES) Y BOBINAS DE REACTANC",145076818.6979174,D_31,0.016410210695209645,De potencia inf,Aparatos eléctricos
85044090990Z,D_30,1295913.0608093836,850440,"Los demás // Los demás // Los demás // -Convertidores estáticos // TRANSFORMADORES ELECTRICOS, CONVERTIDORES ELECTRICOS ESTÁTICOS (POR EJEMPLO:RECTIFICADORES) Y BOBINAS DE REACTANCIA (AUTOINDUCCIÓN).",15824215.193838678,D_30,0.0818943021777131,Los demás // Lo,Maquinaria de oficina
84439923000L,D_30,743814.7715669699,844399,"Cartuchos de tinta // Mecanismos de impresión a chorro de tinta, sus   partes y accesorios // --Los demás // -Partes y accesorios: // MÁQUINAS Y APARATOS PARA IMPRIMIR MEDIANTE PLANCHAS, CILINDROS Y DEMÁS ELEMENTOS IMPRESORES DE LA PARTIDA 84.42; LAS DEM",15824215.193838678,D_30,0.04700484431332695,Cartuchos de ti,Maquinaria de oficina
84729030000J,D_30,477740.02551056363,847290,"Máquinas de clasificar y contar monedas o    billetes de banco // -Los demás // LAS DEMÁS MÁQUINAS Y APARATOS DE OFICINA (POREJEMPLO: COPIADORAS HECTOGRÁFICAS, MIMEÓGRAFOS,MÁQUINAS DE IMPRIMIR DIRECCIONES, DISTRIBUIDORESAUTOMÁTICOS DE BILLETES DE BANCO,",15824215.193838678,D_30,0.030190440388890606,Máquinas de cla,Maquinaria de oficina
85177010000L,D_30,465922.07121715613,851770,"Circuitos impresos con componentes eléctricos   o electrónicos montados // -Partes // TELEFONOS, INCLUIDOS LOS TELEFONOS CELULARES (MÓVILES)* Y LOS DE OTRAS REDES INALÁMBRICAS; LOS DEMÁS APARATOS DE EMISIÓN, TRANSMISIÓN O RECEPCIÓN DE VOZ, IMAGEN U OTROS",15824215.193838678,D_30,0.02944361319091311,Circuitos impre,Maquinaria de oficina
84734090900P,D_30,296049.3704417608,847340,"Partes (R.909/94 MEOSP) // Los demás // -Partes y accesorios de máquinas de la partida 84.72 // PARTES Y ACCESORIOS (EXCEPTO LOS ESTUCHES, FUNDASY SIMILARES) IDENTIFICABLES COMO DESTINADOS,EXCLUSIVA O PRINCIPALMENTE, A LAS MÁQUINAS OAPARATOS DE LAS PARTI",15824215.193838678,D_30,0.018708628947173993,Partes (R.909/9,Maquinaria de oficina
84716052000H,D_30,174735.01445181808,847160,"Teclados // Unidades de entrada // -Unidades de entrada o salida, aunque incluyan unidades de memoria en la misma envoltura // MÁQUINAS AUTOMÁTICAS PARA TRATAMIENTO OPROCESAMIENTO DE DATOS Y SUS UNIDADES; LECTORESMAGNETICOS U ÓPTICOS, MÁQUINAS PARA REGIS",15824215.193838678,D_30,0.01104225469076362,Teclados // Uni,Maquinaria de oficina
90268000000U,D_30,155687.88818426715,902680,"-Los demás instrumentos y aparatos // INSTRUMENTOS Y APARATOS PARA MEDIDA O CONTROL DEL CAUDAL, NIVEL, PRESIÓN U OTRAS CARACTERÍSTICAS VARIABLES DE LÍQUIDOS O GASES (POR EJEMPLO: CAUDALÍMETROS, INDICADORES DE NIVEL, MANÓMETROS, CONTADORES DE CALOR), EXCE",15824215.193838678,D_30,0.009838585122685,-Los demás inst,Maquinaria de oficina
84238110140W,D_30,147214.1736298525,842381,"De capacidad superior a 10 kg pero       inferior o igual a 15 kg // Electrónicas // De mostrador, con dispositivo registrador o   impresor de etiquetas // --Con capacidad inferior o igual a 30 kg // -Los demás aparatos e instrumentos de pesar: // APARAT",15824215.193838678,D_30,0.009303094771307955,De capacidad su,Maquinaria de oficina
84719012000L,D_30,114333.02083322786,847190,"Lectores de códigos de barras // Lectores o grabadores // -Los demás // MÁQUINAS AUTOMÁTICAS PARA TRATAMIENTO OPROCESAMIENTO DE DATOS Y SUS UNIDADES; LECTORESMAGNETICOS U ÓPTICOS, MÁQUINAS PARA REGISTRO DEDATOS SOBRE SOPORTE EN FORMA CODIFICADA Y MÁQUINA",15824215.193838678,D_30,0.007225193757333672,Lectores de cód,Maquinaria de oficina
84714110000M,D_30,102468.89339896399,847141,"De peso inferior a 750 g, sin teclado, con   reconocimiento de escritura, entrada de datos   y de comandos a través de una pantalla   («display») de área inferior a 280 cm2 // --Que incluyan en la misma envoltura, al menos,  una unidad central de proceso",15824215.193838678,D_30,0.0064754486806310185,De peso inferio,Maquinaria de oficina
84378010200W,D_29_30_31_32_33,780367.5278297368,843780,"Molinos de cilindros, de simple o doble         pasada // Para trituración o molienda de granos // -Las demás máquinas y aparatos // MÁQUINAS PARA LIMPIEZA, CLASIFICACIÓN OCRIBADO DE SEMILLAS, GRANOS U HORTALIZAS DE VAINASECAS; MÁQUINAS Y APARATOS PARA M",28434981.82678299,D_29_30_31_32_33,0.027443925675194433,Molinos de cili,D_29_30_31_32_33
84771011400Y,D_29_30_31_32_33,95843.91893009147,847710,"Con fuerza de cierre superior a 1.800 kN      pero inferior o igual a 2.600 kN // Monocolor para materiales termoplásticos, con    capacidad de inyección inferior o igual a     5.000 g y fuerza de cierre inferior o igual    a 12.000 kN // Horizontales, d",28434981.82678299,D_29_30_31_32_33,0.0033706340842397098,Con fuerza de c,D_29_30_31_32_33
84431390800Q,D_29_30_31_32_33,49163.57143951298,844313,"Las dem?s, alimentadas con hojas de formato      inferior o igual a 72 cm x 102 cm, para la      impresi?n en dos o m?s colores      simult?neamente // Las dem?s, alimentadas con hojas de formato      inferior o igual a 72 cm x 102 cm, para la      impre",28434981.82678299,D_29_30_31_32_33,0.0017289819891217822,"Las dem?s, alim",D_29_30_31_32_33
84378090140G,D_29_30_31_32_33,36806.85266610613,843780,"Molinos y trituradores // Para el tratamiento de cereales u      hortalizas de vainas secas // Los demás // -Las demás máquinas y aparatos // MÁQUINAS PARA LIMPIEZA, CLASIFICACIÓN OCRIBADO DE SEMILLAS, GRANOS U HORTALIZAS DE VAINASECAS; MÁQUINAS Y APARAT",28434981.82678299,D_29_30_31_32_33,0.0012944215294499557,Molinos y tritu,D_29_30_31_32_33
85141010000W,D_29_30_31_32_33,22773.864560030033,851410,"Industriales // -Hornos de resistencia (de calentamiento indirecto) // HORNOS ELECTRICOS INDUSTRIALES O DE LABORATORIO,INCLUIDOS LOS QUE FUNCIONEN POR INDUCCIÓN O PERDIDAS DIELECTRICAS; LOS DEMÁS APARATOS INDUSTRIALES O DE LABORATORIO PARA TRATAMIENTO TE",28434981.82678299,D_29_30_31_32_33,0.0008009101148283227,Industriales //,D_29_30_31_32_33
84775911000Q,D_29_30_31_32_33,22543.386841802636,847759,"Con una capacidad inferior o igual a    30.000 kN // Prensas // --Los demás // -Las demás máquinas y aparatos de moldear o  formar: // MÁQUINAS Y APARATOS PARA TRABAJAR CAUCHO O PLÁSTICO O PARA FABRICAR PRODUCTOS DE ESTASMATERIAS, NO EXPRESADOS NI COMPRE",28434981.82678299,D_29_30_31_32_33,0.0007928046861126866,Con una capacid,D_29_30_31_32_33
84251100200R,D_29_30_31_32_33,22040.282414769477,842511,Con capacidad superior a 10 t pero inferior      o igual a 20 t // --Con motor eléctrico // -Polipastos: // POLIPASTOS; TORNOS Y CABRESTANTES; GATOS.,28434981.82678299,D_29_30_31_32_33,0.000775111535116568,Con capacidad s,D_29_30_31_32_33
84807900900R,D_29_30_31_32_33,9139.756581576028,848079,"Los demás // --Los demás // -Moldes para caucho o plástico: // CAJAS DE FUNDICIÓN; PLACAS DE FONDO PARAMOLDES; MODELOS PARA MOLDES; MOLDES PARA METAL (EXCEPTO LAS LINGOTERAS), CARBUROS METÁLICOS, VIDRIO, MATERIA MINERAL, CAUCHO O PLÁSTICO.",28434981.82678299,D_29_30_31_32_33,0.00032142649632247225,Los demás // --,D_29_30_31_32_33
84193200110H,D_29_30_31_32_33,7693.28228620902,841932,"T?neles de radiadores infrarrojos de       longitud de onda media aptos para el secado       de molduras y perfiles // Para madera // --Para madera, pasta para papel, papel o cartón // -Secadores: // APARATOS Y DISPOSITIVOS, AUNQUE SE CALIENTENELECTRICAM",28434981.82678299,D_29_30_31_32_33,0.00027055696160011944,T?neles de radi,D_29_30_31_32_33
84771011200M,D_29_30_31_32_33,7130.574692041177,847710,"Con fuerza de cierre superior a 800 kN pero      inferior o igual a 1.200 kN // Monocolor para materiales termoplásticos, con    capacidad de inyección inferior o igual a     5.000 g y fuerza de cierre inferior o igual    a 12.000 kN // Horizontales, de",28434981.82678299,D_29_30_31_32_33,0.00025076768944247636,Con fuerza de c,D_29_30_31_32_33
84143011000A,D_29,67704953.80214979,841430,"Con capacidad inferior a 4.700 frigor?as/h // Motocompresores herméticos // -Compresores de los tipos utilizados en los  equipos frigoríficos // BOMBAS DE AIRE O DE VACÍO, COMPRESORES DE AIRE UOTROS GASES Y VENTILADORES; CAMPANASASPIRANTES PARA EXTRACCIÓ",547932245.8041716,D_29,0.12356446316238016,Con capacidad i,Maquinaria y equipo
85177010000L,D_29,53191637.453698546,851770,"Circuitos impresos con componentes eléctricos   o electrónicos montados // -Partes // TELEFONOS, INCLUIDOS LOS TELEFONOS CELULARES (MÓVILES)* Y LOS DE OTRAS REDES INALÁMBRICAS; LOS DEMÁS APARATOS DE EMISIÓN, TRANSMISIÓN O RECEPCIÓN DE VOZ, IMAGEN U OTROS",547932245.8041716,D_29,0.09707703436148744,Circuitos impre,Maquinaria y equipo
84272090220A,D_29,21583306.93872748,842720,"De torre triple // Con capacidad de carga superior a 1 t pero      inferior o igual a 2,5 t // Las demás // -Las demás carretillas autopropulsadas // CARRETILLAS APILADORAS; LAS DEMÁS CARRETILLAS DE MANIPULACIÓN CON DISPOSITIVO DE ELEVACIÓNINCORPORADO.",547932245.8041716,D_29,0.03939046680315517,De torre triple,Maquinaria y equipo
90138010000C,D_29,20413240.074016694,901380,"Dispositivos de cristal líquido (LCD) // -Los demás dispositivos, aparatos e instrumentos // DISPOSITIVOS DE CRISTAL LÍQUIDO QUE NOCONSTITUYAN ARTÍCULOS COMPRENDIDOS MÁS ESPECÍFICAMENTE EN OTRA PARTE; LÁSERES, EXCEPTOLOS DIODOS LÁSER; LOS DEMÁS APARATOS",547932245.8041716,D_29,0.037255044269309694,Dispositivos de,Maquinaria y equipo
84189900900Y,D_29,19634506.926621523,841899,"Los dem?s // Los dem?s // --Las demás // -Partes: // REFRIGERADORES, CONGELADORES Y DEMÁS MATERIAL,MÁQUINAS Y APARATOS PARA PRODUCCIÓN DE FRÍO, AUNQUE NO SEAN ELECTRICOS; BOMBAS DE CALOR,EXCEPTO LAS MÁQUINAS Y APARATOS PARA ACONDICIONAMIENTO DE AIRE DE L",547932245.8041716,D_29,0.03583382266142227,Los dem?s // Lo,Maquinaria y equipo
84295199000T,D_29,18826138.0648528,842951,"Las dem?s // Las dem?s // Las demás // --Cargadoras y palas cargadoras de carga frontal // -Palas mecánicas, excavadoras, cargadoras y palas cargadoras: // TOPADORAS FRONTALES («BULLDOZERS»), TOPADORAS ANGULARES («ANGLEDOZERS»), NIVELADORAS, TRAÍLLAS(«SC",547932245.8041716,D_29,0.03435851459558227,Las dem?s // La,Maquinaria y equipo
84143019000L,D_29,15939369.155648649,841430,"Los dem?s // Los dem?s // Motocompresores herméticos // -Compresores de los tipos utilizados en los  equipos frigoríficos // BOMBAS DE AIRE O DE VACÍO, COMPRESORES DE AIRE UOTROS GASES Y VENTILADORES; CAMPANASASPIRANTES PARA EXTRACCIÓN O RECICLADO, CONVE",547932245.8041716,D_29,0.02909003672936837,Los dem?s // Lo,Maquinaria y equipo
85044010000T,D_29,10001978.59860404,850440,"Cargadores de acumuladores // -Convertidores estáticos // TRANSFORMADORES ELECTRICOS, CONVERTIDORES ELECTRICOS ESTÁTICOS (POR EJEMPLO:RECTIFICADORES) Y BOBINAS DE REACTANCIA (AUTOINDUCCIÓN).",547932245.8041716,D_29,0.018254042676252167,Cargadores de a,Maquinaria y equipo
85437099939Z,D_29,8028207.505426385,854370,"Las demás // Lámparas conformadas por diodos de        luz (""LEDs"") // Los demás // Los demás // Los demás // -Las demás máquinas y aparatos: // MÁQUINAS Y APARATOS ELECTRICOS CON FUNCION PROPIA, NO EXPRESADOS NI COMPRENDIDOS EN OTRA PARTE DE ESTE CAPÍTU",547932245.8041716,D_29,0.014651825233690716,Las demás // Lá,Maquinaria y equipo
84295192000P,D_29,6214182.250424083,842951,"De potencia en volante inferior o igual a    43,99 kW (59 HP) // Las demás // --Cargadoras y palas cargadoras de carga frontal // -Palas mecánicas, excavadoras, cargadoras y palas cargadoras: // TOPADORAS FRONTALES («BULLDOZERS»), TOPADORAS ANGULARES («A",547932245.8041716,D_29,0.011341150841202734,De potencia en ,Maquinaria y equipo
73269090900X,D_28,12933267.283102458,732690,Las demás // Las demás // -Las demás // LAS DEMÁS MANUFACTURAS DE HIERRO O ACERO.,175079981.35260493,D_28,0.07387062291864946,Las demás // La,Otros productos de metal
39269090999A,D_28,4856701.566508422,392690,Las demás // Las demás // Las demás // Las demás // -Las demás // LAS DEMÁS MANUFACTURAS DE PLÁSTICO Y MANUFACTURASDE LAS DEMÁS MATERIAS DE LAS PARTIDAS 39.01 A 39.14.,175079981.35260493,D_28,0.02773990223775039,Las demás // La,Otros productos de metal
84798999900H,D_28,4630224.211693682,847989,"Los demás // Los demás // Los demás // --Los demás // -Las demás máquinas y aparatos: // MÁQUINAS Y APARATOS MECÁNICOS CON FUNCIÓNPROPIA, NO EXPRESADOS NI COMPRENDIDOS EN OTRAPARTE DE ESTE CAPÍTULO.",175079981.35260493,D_28,0.0264463371307344,Los demás // Lo,Otros productos de metal
84818095000U,D_28,3969454.539128273,848180,"Válvulas esféricas // Los demás // -Los demás artículos de grifería y órganos similares // ARTÍCULOS DE GRIFERÍA Y ÓRGANOS SIMILARES PARATUBERÍAS, CALDERAS, DEPÓSITOS, CUBAS OCONTINENTES SIMILARES, INCLUIDAS LAS VÁLVULASREDUCTORAS DE PRESIÓN Y LAS VÁLVUL",175079981.35260493,D_28,0.022672235331884866,Válvulas esféri,Otros productos de metal
84561011000R,D_28,3928247.8143118424,845610,Para corte de chapas metálicas de espesor     superior a 8 mm // De control numérico // -Que operen mediante láser u otros haces de luz o de fotones // MÁQUINAS HERRAMIENTA QUE TRABAJEN POR ARRANQUE DECUALQUIER MATERIA MEDIANTE LÁSER U OTROS HACES DELUZ,175079981.35260493,D_28,0.022436875900737556,Para corte de c,Otros productos de metal
84581199000E,D_28,3688792.798945229,845811,Los dem?s // Los dem?s // Los demás // --De control numérico // -Tornos horizontales: // TORNOS (INCLUIDOS LOS CENTROS DE TORNEADO) QUETRABAJEN POR ARRANQUE DE METAL.,175079981.35260493,D_28,0.021069186610867464,Los dem?s // Lo,Otros productos de metal
84621011000N,D_28,3550907.11593453,846210,"M?quinas de estampar // De control numérico // -Máquinas (incluidas las prensas) de forjar o estampar, martillos pilón y otras máquinas de martillar // MÁQUINAS (INCLUIDAS LAS PRENSAS) DE FORJAR OESTAMPAR, MARTILLOS PILÓN Y OTRAS MÁQUINAS DEMARTILLAR, PA",175079981.35260493,D_28,0.02028162836494212,M?quinas de est,Otros productos de metal
84571000000T,D_28,3416866.896572946,845710,"-Centros de mecanizado // CENTROS DE MECANIZADO, MÁQUINAS DE PUESTO FIJOY MÁQUINAS DE PUESTOS MÚLTIPLES, PARA TRABAJARMETAL.",175079981.35260493,D_28,0.019516034158648304,-Centros de mec,Otros productos de metal
40169300990H,D_28,3185468.1178848287,401693,Las demás // Las demás // --Juntas o empaquetaduras // -Las demás: // LAS DEMÁS MANUFACTURAS DE CAUCHO VULCANIZADO SIN ENDURECER.,175079981.35260493,D_28,0.018194359476594917,Las demás // La,Otros productos de metal
84569000000M,D_28,3015393.976068475,845690,"-Las dem?s // MÁQUINAS HERRAMIENTA QUE TRABAJEN POR ARRANQUE DECUALQUIER MATERIA MEDIANTE LÁSER U OTROS HACES DELUZ O DE FOTONES, POR ULTRASONIDO,ELECTROEROSIÓN, PROCESOS ELECTROQUÍMICOS, HACESDE ELECTRONES, HACES IÓNICOS O CHORRO DE PLASMA; MÁQUINAS PAR",175079981.35260493,D_28,0.017222951206486464,-Las dem?s // M,Otros productos de metal
85152100000F,D_27,2950311.144244528,851521,"--Total o parcialmente automáticos // -Máquinas y aparatos para soldar metal por  resistencia: // MÁQUINAS Y APARATOS PARA SOLDAR (AUNQUE PUEDANCORTAR), ELECTRICOS (INCLUIDOS LOS DE GASCALENTADO ELECTRICAMENTE), DE LÁSER U OTROS HACESDE LUZ O DE FOTONES,",73359292.48926204,D_27,0.04021727914941899,--Total o parci,Metales comunes
73181500399N,D_27,1546234.2805927661,731815,"Los demás // Los demás // Pernos (bulones) // --Los demás tornillos y pernos, incluso con sus  tuercas y arandelas // -Artículos roscados: // TORNILLOS, PERNOS, TUERCAS, TIRAFONDOS, ESCARPIASROSCADAS, REMACHES, PASADORES, CLAVIJAS, CHAVETAS,ARANDELAS (IN",73359292.48926204,D_27,0.021077551706473942,Los demás // Lo,Metales comunes
84289090900Z,D_27,1461343.8408090028,842890,"Los dem?s // Los dem?s // Los demás // -Las demás máquinas y aparatos // LAS DEMÁS MÁQUINAS Y APARATOS DE ELEVACIÓN, CARGA, DESCARGA O MANIPULACIÓN (POR EJEMPLO:ASCENSORES, ESCALERAS MECÁNICAS, TRANSPORTADORES,TELÉFERICOS).",73359292.48926204,D_27,0.019920364431307822,Los dem?s // Lo,Metales comunes
73079200000L,D_27,1155884.9704263478,730792,"--Codos, curvas y manguitos, roscados // -Los demás: // ACCESORIOS DE TUBERÍA (POR EJEMPLO: EMPALMES [RACORES], CODOS, MANGUITOS), DE FUNDICIÓN,HIERRO O ACERO.",73359292.48926204,D_27,0.015756490162381818,"--Codos, curvas",Metales comunes
74111010900Z,D_27,1062086.3096935523,741110,Los demás // Sin aletas ni ranuras // -De cobre refinado // TUBOS DE COBRE.,73359292.48926204,D_27,0.014477870132798991,Los demás // Si,Metales comunes
84622100210L,D_27,1053445.8230647286,846221,"Tubos // De curvar // --De control numérico // -Máquinas (incluidas las prensas) de enrollar, curvar, plegar, enderezar o aplanar: // MÁQUINAS (INCLUIDAS LAS PRENSAS) DE FORJAR OESTAMPAR, MARTILLOS PILÓN Y OTRAS MÁQUINAS DEMARTILLAR, PARA TRABAJAR METAL;",73359292.48926204,D_27,0.014360087009003345,Tubos // De cur,Metales comunes
84615020000D,D_27,951696.7827655931,846150,"Circulares // -Máquinas de aserrar o trocear // MÁQUINAS DE CEPILLAR, LIMAR, MORTAJAR, BROCHAR,TALLAR O ACABAR ENGRANAJES, ASERRAR, TROCEAR YDEMÁS MÁQUINAS HERRAMIENTA QUE TRABAJEN PORARRANQUE DE METAL O CERMET, NO EXPRESADAS NICOMPRENDIDAS EN OTRA PARTE",73359292.48926204,D_27,0.012973091076429038,Circulares // -,Metales comunes
84798999900H,D_27,750992.0335448401,847989,"Los demás // Los demás // Los demás // --Los demás // -Las demás máquinas y aparatos: // MÁQUINAS Y APARATOS MECÁNICOS CON FUNCIÓNPROPIA, NO EXPRESADOS NI COMPRENDIDOS EN OTRAPARTE DE ESTE CAPÍTULO.",73359292.48926204,D_27,0.010237176614738568,Los demás // Lo,Metales comunes
84629920000L,D_27,673043.2148706698,846299,"Prensas de extruir // --Las demás // -Las demás: // MÁQUINAS (INCLUIDAS LAS PRENSAS) DE FORJAR OESTAMPAR, MARTILLOS PILÓN Y OTRAS MÁQUINAS DEMARTILLAR, PARA TRABAJAR METAL; MÁQUINAS(INCLUIDAS LAS PRENSAS) DE ENROLLAR, CURVAR,PLEGAR, ENDEREZAR, APLANAR, C",73359292.48926204,D_27,0.009174614313097232,Prensas de extr,Metales comunes
82079000900N,D_27,593233.9371216375,820790,"Los demás // -Los demás útiles intercambiables // ÚTILES INTERCAMBIABLES PARA HERRAMIENTAS DE MANO,INCLUSO MECÁNICAS, O PARA MÁQUINAS HERRAMIENTA(POR EJEMPLO: DE EMBUTIR, ESTAMPAR, PUNZONAR,ROSCAR [INCLUSO ATERRAJAR], TALADRAR, ESCARIAR, BROCHAR, FRESAR,",73359292.48926204,D_27,0.008086691092453925,Los demás // -L,Metales comunes
84289090900Z,D_26,13312004.79293775,842890,"Los dem?s // Los dem?s // Los demás // -Las demás máquinas y aparatos // LAS DEMÁS MÁQUINAS Y APARATOS DE ELEVACIÓN, CARGA, DESCARGA O MANIPULACIÓN (POR EJEMPLO:ASCENSORES, ESCALERAS MECÁNICAS, TRANSPORTADORES,TELÉFERICOS).",159100664.7699825,D_26,0.08367032791587257,Los dem?s // Lo,Otros minerales no metálicos
70109021100R,D_26,8736213.427846598,701090,"Aptas para estar en contacto con alimentos // Bombonas (damajuanas) y botellas // De capacidad superior a 0,33 l pero inferior o   igual a 1 l // -Los demás // BOMBONAS (DAMAJUANAS), BOTELLAS, FRASCOS,BOCALES, TARROS, ENVASES TUBULARES, AMPOLLAS YDEMÁS R",159100664.7699825,D_26,0.05490997438933931,Aptas para esta,Otros minerales no metálicos
84178090000X,D_26,6300940.097432034,841780,"Los dem?s // Los dem?s // -Los demás // HORNOS INDUSTRIALES O DE LABORATORIO, INCLUIDOS LOS INCINERADORES, QUE NO SEAN ELECTRICOS.",159100664.7699825,D_26,0.03960348064253238,Los dem?s // Lo,Otros minerales no metálicos
87054000100V,D_26,6145576.163028896,870540,"De cuatro (4) o más ejes y al menos dos (2)      de ellos direccionales con tracción 8 x 4 y      10 x 4 // -Camiones hormigonera // VEHÍCULOS AUTOMÓVILES PARA USOS ESPECIALES, EXCEPTO LOS CONCEBIDOS PRINCIPALMENTE PARA EL TRANSPORTE DE PERSONAS O MERCAN",159100664.7699825,D_26,0.03862696722175093,De cuatro (4) o,Otros minerales no metálicos
84649090000J,D_26,5204114.353588345,846490,"Las dem?s // Las dem?s // -Las demás // MÁQUINAS HERRAMIENTA PARA TRABAJAR PIEDRA,CERÁMICA, HORMIGÓN, AMIANTO CEMENTOO MATERIAS MINERALES SIMILARES, O PARA TRABAJAREL VIDRIO EN FRÍO.",159100664.7699825,D_26,0.032709570139836434,Las dem?s // La,Otros minerales no metálicos
84798999900H,D_26,3903089.2026792294,847989,"Los demás // Los demás // Los demás // --Los demás // -Las demás máquinas y aparatos: // MÁQUINAS Y APARATOS MECÁNICOS CON FUNCIÓNPROPIA, NO EXPRESADOS NI COMPRENDIDOS EN OTRAPARTE DE ESTE CAPÍTULO.",159100664.7699825,D_26,0.024532199210619672,Los demás // Lo,Otros minerales no metálicos
84193900900G,D_26,3868594.572986225,841939,"Los dem?s // Los dem?s // --Los demás // -Secadores: // APARATOS Y DISPOSITIVOS, AUNQUE SE CALIENTENELECTRICAMENTE (EXCEPTO LOS HORNOS Y DEMÁSAPARATOS DE LA PARTIDA 85.14), PARA EL TRATAMIENTODE MATERIAS MEDIANTE OPERACIONES QUE IMPLIQUEN UN CAMBIO DE TE",159100664.7699825,D_26,0.024315389119078733,Los dem?s // Lo,Otros minerales no metálicos
84805000000G,D_26,3596250.551400023,848050,"-Moldes para vidrio // CAJAS DE FUNDICIÓN; PLACAS DE FONDO PARAMOLDES; MODELOS PARA MOLDES; MOLDES PARA METAL (EXCEPTO LAS LINGOTERAS), CARBUROS METÁLICOS, VIDRIO, MATERIA MINERAL, CAUCHO O PLÁSTICO.",159100664.7699825,D_26,0.022603617380224345,-Moldes para vi,Otros minerales no metálicos
